Region,Cost_of_Living_Index,Avg_PreTax_Stipend_USD,Avg_TA_RA_Hour_Req,Note
California (Bay Area / LA),Extremely High,35000-45000,20 hrs/week,"Often requires supplementary summer internships due to high rent. Stipend sounds high but saving is near zero."
New York City (Columbia/NYU),Extremely High,40000-48000,20 hrs/week,"Rent consumes 50%+ of stipend. Frequent union strikes for living wages."
Midwest (UMich/UIUC/Purdue),Low-Medium,28000-34000,20 hrs/week,"The sweet spot. High saving potential. $30k here feels like $50k in Cali."
Texas (UT Austin/TAMU),Medium,26000-32000,20 hrs/week,"No state income tax offsets slightly lower stipends."
Northeast (Ivy Non-NYC),High,35000-42000,15-20 hrs/week,"Ivy league endowments often mean guaranteed 5 years without desperate TA-ing."
